3.052905 IP 10.1.3.2.49153 > 10.1.2.2.5001: Flags [S], seq 0, win 65535, options [TS val 3000 ecr 0,wscale 2,sackOK,eol], length 0
3.055914 IP 10.1.3.3.49153 > 10.1.2.3.5001: Flags [S], seq 0, win 65535, options [TS val 3000 ecr 0,wscale 2,sackOK,eol], length 0
3.057842 IP 10.1.3.1.49153 > 10.1.2.1.5001: Flags [S], seq 0, win 65535, options [TS val 3000 ecr 0,wscale 2,sackOK,eol], length 0
3.060386 IP 10.1.2.3.5001 > 10.1.3.3.49153: Flags [S.], seq 0, ack 1, win 65535, options [TS val 3056 ecr 3000,wscale 2,sackOK,eol], length 0
3.065260 IP 10.1.2.2.5001 > 10.1.3.2.49153: Flags [S.], seq 0, ack 1, win 65535, options [TS val 3059 ecr 3000,wscale 2,sackOK,eol], length 0
3.068964 IP 10.1.2.1.5001 > 10.1.3.1.49153: Flags [S.], seq 0, ack 1, win 65535, options [TS val 3061 ecr 3000,wscale 2,sackOK,eol], length 0
3.163394 IP 10.1.3.3.49153 > 10.1.2.3.5001: Flags [.], ack 1, win 32768, options [TS val 3112 ecr 3056,eol], length 0
3.173259 IP 10.1.3.2.49153 > 10.1.2.2.5001: Flags [.], ack 1, win 32768, options [TS val 3122 ecr 3059,eol], length 0
3.174317 IP 10.1.3.1.49153 > 10.1.2.1.5001: Flags [.], ack 1, win 32768, options [TS val 3124 ecr 3061,eol], length 0
3.354587 IP 10.1.3.2.49153 > 10.1.2.2.5001: Flags [.], seq 1:513, ack 1, win 32768, options [TS val 3303 ecr 3059,eol], length 512
3.355631 IP 10.1.3.2.49153 > 10.1.2.2.5001: Flags [.], seq 513:1025, ack 1, win 32768, options [TS val 3303 ecr 3059,eol], length 512
3.355683 IP 10.1.2.2.5001 > 10.1.3.2.49153: Flags [.], ack 513, win 32768, options [TS val 3355 ecr 3303,eol], length 0
3.356558 IP 10.1.3.2.49153 > 10.1.2.2.5001: Flags [.], seq 1025:1537, ack 1, win 32768, options [TS val 3303 ecr 3059,eol], length 512
3.357593 IP 10.1.3.2.49153 > 10.1.2.2.5001: Flags [.], seq 1537:2049, ack 1, win 32768, options [TS val 3304 ecr 3059,eol], length 512
3.357910 IP 10.1.2.2.5001 > 10.1.3.2.49153: Flags [.], ack 1537, win 32768, options [TS val 3357 ecr 3303,eol], length 0
3.358601 IP 10.1.3.2.49153 > 10.1.2.2.5001: Flags [.], seq 2049:2561, ack 1, win 32768, options [TS val 3304 ecr 3059,eol], length 512
3.359296 IP 10.1.3.2.49153 > 10.1.2.2.5001: Flags [.], seq 2561:3073, ack 1, win 32768, options [TS val 3305 ecr 3059,eol], length 512
3.360045 IP 10.1.3.2.49153 > 10.1.2.2.5001: Flags [.], seq 3073:3585, ack 1, win 32768, options [TS val 3305 ecr 3059,eol], length 512
3.360120 IP 10.1.2.2.5001 > 10.1.3.2.49153: Flags [.], ack 2561, win 32768, options [TS val 3359 ecr 3304,eol], length 0
3.360713 IP 10.1.3.2.49153 > 10.1.2.2.5001: Flags [.], seq 3585:4097, ack 1, win 32768, options [TS val 3305 ecr 3059,eol], length 512
3.361453 IP 10.1.3.2.49153 > 10.1.2.2.5001: Flags [.], seq 4097:4609, ack 1, win 32768, options [TS val 3306 ecr 3059,eol], length 512
3.362121 IP 10.1.3.2.49153 > 10.1.2.2.5001: Flags [.], seq 4609:5121, ack 1, win 32768, options [TS val 3306 ecr 3059,eol], length 512
3.362142 IP 10.1.2.2.5001 > 10.1.3.2.49153: Flags [.], ack 3585, win 32768, options [TS val 3361 ecr 3305,eol], length 0
3.363779 IP 10.1.2.2.5001 > 10.1.3.2.49153: Flags [.], ack 4609, win 32768, options [TS val 3363 ecr 3305,eol], length 0
3.457271 IP 10.1.3.2.49153 > 10.1.2.2.5001: Flags [.], seq 5121:5657, ack 1, win 32768, options [TS val 3405 ecr 3355,eol], length 536
3.458123 IP 10.1.2.2.5001 > 10.1.3.2.49153: Flags [.], ack 5657, win 32768, options [TS val 3457 ecr 3306,eol], length 0
3.459498 IP 10.1.3.2.49153 > 10.1.2.2.5001: Flags [.], seq 5657:6193, ack 1, win 32768, options [TS val 3408 ecr 3357,eol], length 536
3.460298 IP 10.1.3.2.49153 > 10.1.2.2.5001: Flags [.], seq 6193:6729, ack 1, win 32768, options [TS val 3408 ecr 3357,eol], length 536
3.461062 IP 10.1.3.2.49153 > 10.1.2.2.5001: Flags [.], seq 6729:7265, ack 1, win 32768, options [TS val 3408 ecr 3357,eol], length 536
3.461111 IP 10.1.2.2.5001 > 10.1.3.2.49153: Flags [.], ack 6729, win 32768, options [TS val 3460 ecr 3408,eol], length 0
3.462091 IP 10.1.3.2.49153 > 10.1.2.2.5001: Flags [.], seq 7265:7801, ack 1, win 32768, options [TS val 3408 ecr 3357,eol], length 536
3.462766 IP 10.1.3.2.49153 > 10.1.2.2.5001: Flags [.], seq 7801:8337, ack 1, win 32768, options [TS val 3410 ecr 3359,eol], length 536
3.462904 IP 10.1.2.2.5001 > 10.1.3.2.49153: Flags [.], ack 7801, win 32768, options [TS val 3462 ecr 3408,eol], length 0
3.463440 IP 10.1.3.2.49153 > 10.1.2.2.5001: Flags [.], seq 8337:8873, ack 1, win 32768, options [TS val 3410 ecr 3359,eol], length 536
3.464114 IP 10.1.3.2.49153 > 10.1.2.2.5001: Flags [.], seq 8873:9409, ack 1, win 32768, options [TS val 3410 ecr 3359,eol], length 536
3.464460 IP 10.1.2.2.5001 > 10.1.3.2.49153: Flags [.], ack 8873, win 32768, options [TS val 3464 ecr 3410,eol], length 0
3.464789 IP 10.1.3.2.49153 > 10.1.2.2.5001: Flags [.], seq 9409:9945, ack 1, win 32768, options [TS val 3410 ecr 3359,eol], length 536
3.465463 IP 10.1.3.2.49153 > 10.1.2.2.5001: Flags [.], seq 9945:10481, ack 1, win 32768, options [TS val 3412 ecr 3361,eol], length 536
3.465828 IP 10.1.2.2.5001 > 10.1.3.2.49153: Flags [.], ack 9945, win 32768, options [TS val 3465 ecr 3410,eol], length 0
3.466137 IP 10.1.3.2.49153 > 10.1.2.2.5001: Flags [.], seq 10481:11017, ack 1, win 32768, options [TS val 3412 ecr 3361,eol], length 536
3.466811 IP 10.1.3.2.49153 > 10.1.2.2.5001: Flags [.], seq 11017:11553, ack 1, win 32768, options [TS val 3412 ecr 3361,eol], length 536
3.467197 IP 10.1.2.2.5001 > 10.1.3.2.49153: Flags [.], ack 11017, win 32768, options [TS val 3466 ecr 3412,eol], length 0
3.467486 IP 10.1.3.2.49153 > 10.1.2.2.5001: Flags [.], seq 11553:12089, ack 1, win 32768, options [TS val 3412 ecr 3361,eol], length 536
3.468160 IP 10.1.3.2.49153 > 10.1.2.2.5001: Flags [.], seq 12089:12625, ack 1, win 32768, options [TS val 3414 ecr 3363,eol], length 536
3.468538 IP 10.1.2.2.5001 > 10.1.3.2.49153: Flags [.], ack 12089, win 32768, options [TS val 3468 ecr 3412,eol], length 0
3.468834 IP 10.1.3.2.49153 > 10.1.2.2.5001: Flags [.], seq 12625:13161, ack 1, win 32768, options [TS val 3414 ecr 3363,eol], length 536
3.469509 IP 10.1.3.2.49153 > 10.1.2.2.5001: Flags [.], seq 13161:13697, ack 1, win 32768, options [TS val 3414 ecr 3363,eol], length 536
3.469906 IP 10.1.2.2.5001 > 10.1.3.2.49153: Flags [.], ack 13161, win 32768, options [TS val 3469 ecr 3414,eol], length 0
3.470183 IP 10.1.3.2.49153 > 10.1.2.2.5001: Flags [.], seq 13697:14233, ack 1, win 32768, options [TS val 3414 ecr 3363,eol], length 536
3.471107 IP 10.1.2.2.5001 > 10.1.3.2.49153: Flags [.], ack 14233, win 32768, options [TS val 3470 ecr 3414,eol], length 0
3.559431 IP 10.1.3.2.49153 > 10.1.2.2.5001: Flags [.], seq 14233:14769, ack 1, win 32768, options [TS val 3508 ecr 3457,eol], length 536
3.560106 IP 10.1.3.2.49153 > 10.1.2.2.5001: Flags [.], seq 14769:15305, ack 1, win 32768, options [TS val 3508 ecr 3457,eol], length 536
3.560626 IP 10.1.2.2.5001 > 10.1.3.2.49153: Flags [.], ack 15305, win 32768, options [TS val 3560 ecr 3508,eol], length 0
3.560780 IP 10.1.3.2.49153 > 10.1.2.2.5001: Flags [.], seq 15305:15841, ack 1, win 32768, options [TS val 3508 ecr 3457,eol], length 536
3.561454 IP 10.1.3.2.49153 > 10.1.2.2.5001: Flags [.], seq 15841:16377, ack 1, win 32768, options [TS val 3508 ecr 3457,eol], length 536
3.561974 IP 10.1.2.2.5001 > 10.1.3.2.49153: Flags [.], ack 16377, win 32768, options [TS val 3561 ecr 3508,eol], length 0
3.562419 IP 10.1.3.2.49153 > 10.1.2.2.5001: Flags [.], seq 16377:16913, ack 1, win 32768, options [TS val 3511 ecr 3460,eol], length 536
3.563093 IP 10.1.3.2.49153 > 10.1.2.2.5001: Flags [.], seq 16913:17449, ack 1, win 32768, options [TS val 3511 ecr 3460,eol], length 536
3.563593 IP 10.1.2.2.5001 > 10.1.3.2.49153: Flags [.], ack 17449, win 32768, options [TS val 3563 ecr 3511,eol], length 0
3.563767 IP 10.1.3.2.49153 > 10.1.2.2.5001: Flags [.], seq 17449:17985, ack 1, win 32768, options [TS val 3511 ecr 3460,eol], length 536
3.564441 IP 10.1.3.2.49153 > 10.1.2.2.5001: Flags [.], seq 17985:18521, ack 1, win 32768, options [TS val 3511 ecr 3460,eol], length 536
3.564942 IP 10.1.2.2.5001 > 10.1.3.2.49153: Flags [.], ack 18521, win 32768, options [TS val 3564 ecr 3511,eol], length 0
3.565116 IP 10.1.3.2.49153 > 10.1.2.2.5001: Flags [.], seq 18521:19057, ack 1, win 32768, options [TS val 3513 ecr 3462,eol], length 536
3.565790 IP 10.1.3.2.49153 > 10.1.2.2.5001: Flags [.], seq 19057:19593, ack 1, win 32768, options [TS val 3513 ecr 3462,eol], length 536
3.566218 IP 10.1.2.2.5001 > 10.1.3.2.49153: Flags [.], ack 19593, win 32768, options [TS val 3566 ecr 3513,eol], length 0
3.566464 IP 10.1.3.2.49153 > 10.1.2.2.5001: Flags [.], seq 19593:20129, ack 1, win 32768, options [TS val 3513 ecr 3462,eol], length 536
3.567139 IP 10.1.3.2.49153 > 10.1.2.2.5001: Flags [.], seq 20129:20665, ack 1, win 32768, options [TS val 3513 ecr 3462,eol], length 536
3.567567 IP 10.1.2.2.5001 > 10.1.3.2.49153: Flags [.], ack 20665, win 32768, options [TS val 3567 ecr 3513,eol], length 0
3.567813 IP 10.1.3.2.49153 > 10.1.2.2.5001: Flags [.], seq 20665:21201, ack 1, win 32768, options [TS val 3514 ecr 3464,eol], length 536
3.568487 IP 10.1.3.2.49153 > 10.1.2.2.5001: Flags [.], seq 21201:21737, ack 1, win 32768, options [TS val 3514 ecr 3464,eol], length 536
3.568915 IP 10.1.2.2.5001 > 10.1.3.2.49153: Flags [.], ack 21737, win 32768, options [TS val 3568 ecr 3514,eol], length 0
3.569161 IP 10.1.3.2.49153 > 10.1.2.2.5001: Flags [.], seq 21737:22273, ack 1, win 32768, options [TS val 3514 ecr 3464,eol], length 536
3.569836 IP 10.1.3.2.49153 > 10.1.2.2.5001: Flags [.], seq 22273:22809, ack 1, win 32768, options [TS val 3514 ecr 3464,eol], length 536
3.570264 IP 10.1.2.2.5001 > 10.1.3.2.49153: Flags [.], ack 22809, win 32768, options [TS val 3570 ecr 3514,eol], length 0
3.570510 IP 10.1.3.2.49153 > 10.1.2.2.5001: Flags [.], seq 22809:23345, ack 1, win 32768, options [TS val 3516 ecr 3465,eol], length 536
3.571184 IP 10.1.3.2.49153 > 10.1.2.2.5001: Flags [.], seq 23345:23881, ack 1, win 32768, options [TS val 3516 ecr 3465,eol], length 536
3.571612 IP 10.1.2.2.5001 > 10.1.3.2.49153: Flags [.], ack 23881, win 32768, options [TS val 3571 ecr 3516,eol], length 0
3.571859 IP 10.1.3.2.49153 > 10.1.2.2.5001: Flags [.], seq 23881:24417, ack 1, win 32768, options [TS val 3516 ecr 3465,eol], length 536
3.572533 IP 10.1.3.2.49153 > 10.1.2.2.5001: Flags [.], seq 24417:24953, ack 1, win 32768, options [TS val 3516 ecr 3465,eol], length 536
3.572889 IP 10.1.2.2.5001 > 10.1.3.2.49153: Flags [.], ack 24953, win 32768, options [TS val 3572 ecr 3516,eol], length 0
3.573207 IP 10.1.3.2.49153 > 10.1.2.2.5001: Flags [.], seq 24953:25489, ack 1, win 32768, options [TS val 3517 ecr 3466,eol], length 536
3.573881 IP 10.1.3.2.49153 > 10.1.2.2.5001: Flags [.], seq 25489:26025, ack 1, win 32768, options [TS val 3517 ecr 3466,eol], length 536
3.574238 IP 10.1.2.2.5001 > 10.1.3.2.49153: Flags [.], ack 26025, win 32768, options [TS val 3574 ecr 3517,eol], length 0
3.574556 IP 10.1.3.2.49153 > 10.1.2.2.5001: Flags [.], seq 26025:26561, ack 1, win 32768, options [TS val 3517 ecr 3466,eol], length 536
3.575230 IP 10.1.3.2.49153 > 10.1.2.2.5001: Flags [.], seq 26561:27097, ack 1, win 32768, options [TS val 3517 ecr 3466,eol], length 536
3.575586 IP 10.1.2.2.5001 > 10.1.3.2.49153: Flags [.], ack 27097, win 32768, options [TS val 3575 ecr 3517,eol], length 0
3.575904 IP 10.1.3.2.49153 > 10.1.2.2.5001: Flags [.], seq 27097:27633, ack 1, win 32768, options [TS val 3518 ecr 3468,eol], length 536
3.576579 IP 10.1.3.2.49153 > 10.1.2.2.5001: Flags [.], seq 27633:28169, ack 1, win 32768, options [TS val 3518 ecr 3468,eol], length 536
3.576915 IP 10.1.2.2.5001 > 10.1.3.2.49153: Flags [.], ack 28169, win 32768, options [TS val 3576 ecr 3518,eol], length 0
3.577253 IP 10.1.3.2.49153 > 10.1.2.2.5001: Flags [.], seq 28169:28705, ack 1, win 32768, options [TS val 3518 ecr 3468,eol], length 536
3.577927 IP 10.1.3.2.49153 > 10.1.2.2.5001: Flags [.], seq 28705:29241, ack 1, win 32768, options [TS val 3518 ecr 3468,eol], length 536
3.578263 IP 10.1.2.2.5001 > 10.1.3.2.49153: Flags [.], ack 29241, win 32768, options [TS val 3578 ecr 3518,eol], length 0
3.578601 IP 10.1.3.2.49153 > 10.1.2.2.5001: Flags [.], seq 29241:29777, ack 1, win 32768, options [TS val 3520 ecr 3469,eol], length 536
3.579276 IP 10.1.3.2.49153 > 10.1.2.2.5001: Flags [.], seq 29777:30313, ack 1, win 32768, options [TS val 3520 ecr 3469,eol], length 536
3.579580 IP 10.1.2.2.5001 > 10.1.3.2.49153: Flags [.], ack 30313, win 32768, options [TS val 3579 ecr 3520,eol], length 0
3.579950 IP 10.1.3.2.49153 > 10.1.2.2.5001: Flags [.], seq 30313:30849, ack 1, win 32768, options [TS val 3520 ecr 3469,eol], length 536
3.580624 IP 10.1.3.2.49153 > 10.1.2.2.5001: Flags [.], seq 30849:31385, ack 1, win 32768, options [TS val 3520 ecr 3469,eol], length 536
3.580928 IP 10.1.2.2.5001 > 10.1.3.2.49153: Flags [.], ack 31385, win 32768, options [TS val 3580 ecr 3520,eol], length 0
3.581299 IP 10.1.3.2.49153 > 10.1.2.2.5001: Flags [.], seq 31385:31921, ack 1, win 32768, options [TS val 3521 ecr 3470,eol], length 536
3.581973 IP 10.1.3.2.49153 > 10.1.2.2.5001: Flags [.], seq 31921:32457, ack 1, win 32768, options [TS val 3521 ecr 3470,eol], length 536
3.582277 IP 10.1.2.2.5001 > 10.1.3.2.49153: Flags [.], ack 32457, win 32768, options [TS val 3582 ecr 3521,eol], length 0
3.582647 IP 10.1.3.2.49153 > 10.1.2.2.5001: Flags [.], seq 32457:32993, ack 1, win 32768, options [TS val 3521 ecr 3470,eol], length 536
3.583321 IP 10.1.3.2.49153 > 10.1.2.2.5001: Flags [.], seq 32993:33529, ack 1, win 32768, options [TS val 3521 ecr 3470,eol], length 536
3.583626 IP 10.1.2.2.5001 > 10.1.3.2.49153: Flags [.], ack 33529, win 32768, options [TS val 3583 ecr 3521,eol], length 0
3.661722 IP 10.1.3.2.49153 > 10.1.2.2.5001: Flags [.], seq 33529:34065, ack 1, win 32768, options [TS val 3610 ecr 3560,eol], length 536
3.662396 IP 10.1.3.2.49153 > 10.1.2.2.5001: Flags [.], seq 34065:34601, ack 1, win 32768, options [TS val 3610 ecr 3560,eol], length 536
3.662700 IP 10.1.2.2.5001 > 10.1.3.2.49153: Flags [.], ack 34601, win 32768, options [TS val 3662 ecr 3610,eol], length 0
3.663070 IP 10.1.3.2.49153 > 10.1.2.2.5001: Flags [.], seq 34601:35137, ack 1, win 32768, options [TS val 3610 ecr 3560,eol], length 536
3.663745 IP 10.1.3.2.49153 > 10.1.2.2.5001: Flags [.], seq 35137:35673, ack 1, win 32768, options [TS val 3610 ecr 3560,eol], length 536
3.664037 IP 10.1.2.2.5001 > 10.1.3.2.49153: Flags [.], ack 35673, win 32768, options [TS val 3663 ecr 3610,eol], length 0
3.664419 IP 10.1.3.2.49153 > 10.1.2.2.5001: Flags [.], seq 35673:36209, ack 1, win 32768, options [TS val 3612 ecr 3561,eol], length 536
3.665093 IP 10.1.3.2.49153 > 10.1.2.2.5001: Flags [.], seq 36209:36745, ack 1, win 32768, options [TS val 3612 ecr 3561,eol], length 536
3.665385 IP 10.1.2.2.5001 > 10.1.3.2.49153: Flags [.], ack 36745, win 32768, options [TS val 3665 ecr 3612,eol], length 0
3.665767 IP 10.1.3.2.49153 > 10.1.2.2.5001: Flags [.], seq 36745:37281, ack 1, win 32768, options [TS val 3612 ecr 3561,eol], length 536
3.666442 IP 10.1.3.2.49153 > 10.1.2.2.5001: Flags [.], seq 37281:37817, ack 1, win 32768, options [TS val 3612 ecr 3561,eol], length 536
3.666734 IP 10.1.2.2.5001 > 10.1.3.2.49153: Flags [.], ack 37817, win 32768, options [TS val 3666 ecr 3612,eol], length 0
3.667116 IP 10.1.3.2.49153 > 10.1.2.2.5001: Flags [.], seq 37817:38353, ack 1, win 32768, options [TS val 3613 ecr 3563,eol], length 536
3.667790 IP 10.1.3.2.49153 > 10.1.2.2.5001: Flags [.], seq 38353:38889, ack 1, win 32768, options [TS val 3613 ecr 3563,eol], length 536
3.668070 IP 10.1.2.2.5001 > 10.1.3.2.49153: Flags [.], ack 38889, win 32768, options [TS val 3667 ecr 3613,eol], length 0
3.668465 IP 10.1.3.2.49153 > 10.1.2.2.5001: Flags [.], seq 38889:39425, ack 1, win 32768, options [TS val 3613 ecr 3563,eol], length 536
3.669139 IP 10.1.3.2.49153 > 10.1.2.2.5001: Flags [.], seq 39425:39961, ack 1, win 32768, options [TS val 3613 ecr 3563,eol], length 536
3.669419 IP 10.1.2.2.5001 > 10.1.3.2.49153: Flags [.], ack 39961, win 32768, options [TS val 3669 ecr 3613,eol], length 0
3.669813 IP 10.1.3.2.49153 > 10.1.2.2.5001: Flags [.], seq 39961:40497, ack 1, win 32768, options [TS val 3615 ecr 3564,eol], length 536
3.670487 IP 10.1.3.2.49153 > 10.1.2.2.5001: Flags [.], seq 40497:41033, ack 1, win 32768, options [TS val 3615 ecr 3564,eol], length 536
3.670768 IP 10.1.2.2.5001 > 10.1.3.2.49153: Flags [.], ack 41033, win 32768, options [TS val 3670 ecr 3615,eol], length 0
3.671162 IP 10.1.3.2.49153 > 10.1.2.2.5001: Flags [.], seq 41033:41569, ack 1, win 32768, options [TS val 3615 ecr 3564,eol], length 536
3.671836 IP 10.1.3.2.49153 > 10.1.2.2.5001: Flags [.], seq 41569:42105, ack 1, win 32768, options [TS val 3615 ecr 3564,eol], length 536
3.672116 IP 10.1.2.2.5001 > 10.1.3.2.49153: Flags [.], ack 42105, win 32768, options [TS val 3671 ecr 3615,eol], length 0
3.672510 IP 10.1.3.2.49153 > 10.1.2.2.5001: Flags [.], seq 42105:42641, ack 1, win 32768, options [TS val 3616 ecr 3566,eol], length 536
3.673185 IP 10.1.3.2.49153 > 10.1.2.2.5001: Flags [.], seq 42641:43177, ack 1, win 32768, options [TS val 3616 ecr 3566,eol], length 536
3.673465 IP 10.1.2.2.5001 > 10.1.3.2.49153: Flags [.], ack 43177, win 32768, options [TS val 3673 ecr 3616,eol], length 0
3.673859 IP 10.1.3.2.49153 > 10.1.2.2.5001: Flags [.], seq 43177:43713, ack 1, win 32768, options [TS val 3616 ecr 3566,eol], length 536
3.674533 IP 10.1.3.2.49153 > 10.1.2.2.5001: Flags [.], seq 43713:44249, ack 1, win 32768, options [TS val 3616 ecr 3566,eol], length 536
3.674813 IP 10.1.2.2.5001 > 10.1.3.2.49153: Flags [.], ack 44249, win 32768, options [TS val 3674 ecr 3616,eol], length 0
3.675207 IP 10.1.3.2.49153 > 10.1.2.2.5001: Flags [.], seq 44249:44785, ack 1, win 32768, options [TS val 3617 ecr 3567,eol], length 536
3.675882 IP 10.1.3.2.49153 > 10.1.2.2.5001: Flags [.], seq 44785:45321, ack 1, win 32768, options [TS val 3617 ecr 3567,eol], length 536
3.676162 IP 10.1.2.2.5001 > 10.1.3.2.49153: Flags [.], ack 45321, win 32768, options [TS val 3676 ecr 3617,eol], length 0
3.676556 IP 10.1.3.2.49153 > 10.1.2.2.5001: Flags [.], seq 45321:45857, ack 1, win 32768, options [TS val 3617 ecr 3567,eol], length 536
3.677230 IP 10.1.3.2.49153 > 10.1.2.2.5001: Flags [.], seq 45857:46393, ack 1, win 32768, options [TS val 3617 ecr 3567,eol], length 536
3.677510 IP 10.1.2.2.5001 > 10.1.3.2.49153: Flags [.], ack 46393, win 32768, options [TS val 3677 ecr 3617,eol], length 0
3.677905 IP 10.1.3.2.49153 > 10.1.2.2.5001: Flags [.], seq 46393:46929, ack 1, win 32768, options [TS val 3619 ecr 3568,eol], length 536
3.678579 IP 10.1.3.2.49153 > 10.1.2.2.5001: Flags [.], seq 46929:47465, ack 1, win 32768, options [TS val 3619 ecr 3568,eol], length 536
3.678859 IP 10.1.2.2.5001 > 10.1.3.2.49153: Flags [.], ack 47465, win 32768, options [TS val 3678 ecr 3619,eol], length 0
3.679253 IP 10.1.3.2.49153 > 10.1.2.2.5001: Flags [.], seq 47465:48001, ack 1, win 32768, options [TS val 3619 ecr 3568,eol], length 536
3.679927 IP 10.1.3.2.49153 > 10.1.2.2.5001: Flags [.], seq 48001:48537, ack 1, win 32768, options [TS val 3619 ecr 3568,eol], length 536
3.680208 IP 10.1.2.2.5001 > 10.1.3.2.49153: Flags [.], ack 48537, win 32768, options [TS val 3680 ecr 3619,eol], length 0
3.680602 IP 10.1.3.2.49153 > 10.1.2.2.5001: Flags [.], seq 48537:49073, ack 1, win 32768, options [TS val 3620 ecr 3570,eol], length 536
3.681276 IP 10.1.3.2.49153 > 10.1.2.2.5001: Flags [.], seq 49073:49609, ack 1, win 32768, options [TS val 3620 ecr 3570,eol], length 536
3.681548 IP 10.1.2.2.5001 > 10.1.3.2.49153: Flags [.], ack 49609, win 32768, options [TS val 3681 ecr 3620,eol], length 0
3.681950 IP 10.1.3.2.49153 > 10.1.2.2.5001: Flags [.], seq 49609:50145, ack 1, win 32768, options [TS val 3620 ecr 3570,eol], length 536
3.682625 IP 10.1.3.2.49153 > 10.1.2.2.5001: Flags [.], seq 50145:50681, ack 1, win 32768, options [TS val 3620 ecr 3570,eol], length 536
3.682897 IP 10.1.2.2.5001 > 10.1.3.2.49153: Flags [.], ack 50681, win 32768, options [TS val 3682 ecr 3620,eol], length 0
3.683299 IP 10.1.3.2.49153 > 10.1.2.2.5001: Flags [.], seq 50681:51217, ack 1, win 32768, options [TS val 3621 ecr 3571,eol], length 536
3.683973 IP 10.1.3.2.49153 > 10.1.2.2.5001: Flags [.], seq 51217:51753, ack 1, win 32768, options [TS val 3621 ecr 3571,eol], length 536
3.684245 IP 10.1.2.2.5001 > 10.1.3.2.49153: Flags [.], ack 51753, win 32768, options [TS val 3684 ecr 3621,eol], length 0
3.684647 IP 10.1.3.2.49153 > 10.1.2.2.5001: Flags [.], seq 51753:52289, ack 1, win 32768, options [TS val 3621 ecr 3571,eol], length 536
3.685322 IP 10.1.3.2.49153 > 10.1.2.2.5001: Flags [.], seq 52289:52825, ack 1, win 32768, options [TS val 3621 ecr 3571,eol], length 536
3.685594 IP 10.1.2.2.5001 > 10.1.3.2.49153: Flags [.], ack 52825, win 32768, options [TS val 3685 ecr 3621,eol], length 0
3.685996 IP 10.1.3.2.49153 > 10.1.2.2.5001: Flags [.], seq 52825:53361, ack 1, win 32768, options [TS val 3623 ecr 3572,eol], length 536
3.686670 IP 10.1.3.2.49153 > 10.1.2.2.5001: Flags [.], seq 53361:53897, ack 1, win 32768, options [TS val 3623 ecr 3572,eol], length 536
3.686942 IP 10.1.2.2.5001 > 10.1.3.2.49153: Flags [.], ack 53897, win 32768, options [TS val 3686 ecr 3623,eol], length 0
3.687345 IP 10.1.3.2.49153 > 10.1.2.2.5001: Flags [.], seq 53897:54433, ack 1, win 32768, options [TS val 3623 ecr 3572,eol], length 536
3.688019 IP 10.1.3.2.49153 > 10.1.2.2.5001: Flags [.], seq 54433:54969, ack 1, win 32768, options [TS val 3623 ecr 3572,eol], length 536
3.688291 IP 10.1.2.2.5001 > 10.1.3.2.49153: Flags [.], ack 54969, win 32768, options [TS val 3688 ecr 3623,eol], length 0
3.688693 IP 10.1.3.2.49153 > 10.1.2.2.5001: Flags [.], seq 54969:55505, ack 1, win 32768, options [TS val 3624 ecr 3574,eol], length 536
3.689367 IP 10.1.3.2.49153 > 10.1.2.2.5001: Flags [.], seq 55505:56041, ack 1, win 32768, options [TS val 3624 ecr 3574,eol], length 536
3.689640 IP 10.1.2.2.5001 > 10.1.3.2.49153: Flags [.], ack 56041, win 32768, options [TS val 3689 ecr 3624,eol], length 0
3.690042 IP 10.1.3.2.49153 > 10.1.2.2.5001: Flags [.], seq 56041:56577, ack 1, win 32768, options [TS val 3624 ecr 3574,eol], length 536
3.690716 IP 10.1.3.2.49153 > 10.1.2.2.5001: Flags [.], seq 56577:57113, ack 1, win 32768, options [TS val 3624 ecr 3574,eol], length 536
3.690988 IP 10.1.2.2.5001 > 10.1.3.2.49153: Flags [.], ack 57113, win 32768, options [TS val 3690 ecr 3624,eol], length 0
3.691390 IP 10.1.3.2.49153 > 10.1.2.2.5001: Flags [.], seq 57113:57649, ack 1, win 32768, options [TS val 3625 ecr 3575,eol], length 536
3.692065 IP 10.1.3.2.49153 > 10.1.2.2.5001: Flags [.], seq 57649:58185, ack 1, win 32768, options [TS val 3625 ecr 3575,eol], length 536
3.692337 IP 10.1.2.2.5001 > 10.1.3.2.49153: Flags [.], ack 58185, win 32768, options [TS val 3692 ecr 3625,eol], length 0
3.692739 IP 10.1.3.2.49153 > 10.1.2.2.5001: Flags [.], seq 58185:58721, ack 1, win 32768, options [TS val 3625 ecr 3575,eol], length 536
3.693413 IP 10.1.3.2.49153 > 10.1.2.2.5001: Flags [.], seq 58721:59257, ack 1, win 32768, options [TS val 3625 ecr 3575,eol], length 536
3.693685 IP 10.1.2.2.5001 > 10.1.3.2.49153: Flags [.], ack 59257, win 32768, options [TS val 3693 ecr 3625,eol], length 0
3.694087 IP 10.1.3.2.49153 > 10.1.2.2.5001: Flags [.], seq 59257:59793, ack 1, win 32768, options [TS val 3627 ecr 3576,eol], length 536
3.694762 IP 10.1.3.2.49153 > 10.1.2.2.5001: Flags [.], seq 59793:60329, ack 1, win 32768, options [TS val 3627 ecr 3576,eol], length 536
3.695026 IP 10.1.2.2.5001 > 10.1.3.2.49153: Flags [.], ack 60329, win 32768, options [TS val 3694 ecr 3627,eol], length 0
3.695436 IP 10.1.3.2.49153 > 10.1.2.2.5001: Flags [.], seq 60329:60865, ack 1, win 32768, options [TS val 3627 ecr 3576,eol], length 536
3.696110 IP 10.1.3.2.49153 > 10.1.2.2.5001: Flags [.], seq 60865:61401, ack 1, win 32768, options [TS val 3627 ecr 3576,eol], length 536
3.696374 IP 10.1.2.2.5001 > 10.1.3.2.49153: Flags [.], ack 61401, win 32768, options [TS val 3696 ecr 3627,eol], length 0
3.696785 IP 10.1.3.2.49153 > 10.1.2.2.5001: Flags [.], seq 61401:61937, ack 1, win 32768, options [TS val 3628 ecr 3578,eol], length 536
3.697459 IP 10.1.3.2.49153 > 10.1.2.2.5001: Flags [.], seq 61937:62473, ack 1, win 32768, options [TS val 3628 ecr 3578,eol], length 536
3.697723 IP 10.1.2.2.5001 > 10.1.3.2.49153: Flags [.], ack 62473, win 32768, options [TS val 3697 ecr 3628,eol], length 0
3.698133 IP 10.1.3.2.49153 > 10.1.2.2.5001: Flags [.], seq 62473:63009, ack 1, win 32768, options [TS val 3628 ecr 3578,eol], length 536
3.698807 IP 10.1.3.2.49153 > 10.1.2.2.5001: Flags [.], seq 63009:63545, ack 1, win 32768, options [TS val 3628 ecr 3578,eol], length 536
3.699072 IP 10.1.2.2.5001 > 10.1.3.2.49153: Flags [.], ack 63545, win 32768, options [TS val 3698 ecr 3628,eol], length 0
3.699482 IP 10.1.3.2.49153 > 10.1.2.2.5001: Flags [.], seq 63545:64081, ack 1, win 32768, options [TS val 3629 ecr 3579,eol], length 536
3.700156 IP 10.1.3.2.49153 > 10.1.2.2.5001: Flags [.], seq 64081:64617, ack 1, win 32768, options [TS val 3629 ecr 3579,eol], length 536
3.700420 IP 10.1.2.2.5001 > 10.1.3.2.49153: Flags [.], ack 64617, win 32768, options [TS val 3700 ecr 3629,eol], length 0
3.700830 IP 10.1.3.2.49153 > 10.1.2.2.5001: Flags [.], seq 64617:65153, ack 1, win 32768, options [TS val 3629 ecr 3579,eol], length 536
3.701505 IP 10.1.3.2.49153 > 10.1.2.2.5001: Flags [.], seq 65153:65689, ack 1, win 32768, options [TS val 3629 ecr 3579,eol], length 536
3.701769 IP 10.1.2.2.5001 > 10.1.3.2.49153: Flags [.], ack 65689, win 32768, options [TS val 3701 ecr 3629,eol], length 0
3.702179 IP 10.1.3.2.49153 > 10.1.2.2.5001: Flags [.], seq 65689:66225, ack 1, win 32768, options [TS val 3631 ecr 3580,eol], length 536
3.702853 IP 10.1.3.2.49153 > 10.1.2.2.5001: Flags [.], seq 66225:66761, ack 1, win 32768, options [TS val 3631 ecr 3580,eol], length 536
3.703117 IP 10.1.2.2.5001 > 10.1.3.2.49153: Flags [.], ack 66761, win 32768, options [TS val 3703 ecr 3631,eol], length 0
3.703527 IP 10.1.3.2.49153 > 10.1.2.2.5001: Flags [.], seq 66761:67297, ack 1, win 32768, options [TS val 3631 ecr 3580,eol], length 536
3.704202 IP 10.1.3.2.49153 > 10.1.2.2.5001: Flags [.], seq 67297:67833, ack 1, win 32768, options [TS val 3631 ecr 3580,eol], length 536
3.704466 IP 10.1.2.2.5001 > 10.1.3.2.49153: Flags [.], ack 67833, win 32768, options [TS val 3704 ecr 3631,eol], length 0
3.704876 IP 10.1.3.2.49153 > 10.1.2.2.5001: Flags [.], seq 67833:68369, ack 1, win 32768, options [TS val 3632 ecr 3582,eol], length 536
3.705550 IP 10.1.3.2.49153 > 10.1.2.2.5001: Flags [.], seq 68369:68905, ack 1, win 32768, options [TS val 3632 ecr 3582,eol], length 536
3.705814 IP 10.1.2.2.5001 > 10.1.3.2.49153: Flags [.], ack 68905, win 32768, options [TS val 3705 ecr 3632,eol], length 0
3.706225 IP 10.1.3.2.49153 > 10.1.2.2.5001: Flags [.], seq 68905:69441, ack 1, win 32768, options [TS val 3632 ecr 3582,eol], length 536
3.706899 IP 10.1.3.2.49153 > 10.1.2.2.5001: Flags [.], seq 69441:69977, ack 1, win 32768, options [TS val 3632 ecr 3582,eol], length 536
3.707163 IP 10.1.2.2.5001 > 10.1.3.2.49153: Flags [.], ack 69977, win 32768, options [TS val 3707 ecr 3632,eol], length 0
3.707573 IP 10.1.3.2.49153 > 10.1.2.2.5001: Flags [.], seq 69977:70513, ack 1, win 32768, options [TS val 3633 ecr 3583,eol], length 536
3.708247 IP 10.1.3.2.49153 > 10.1.2.2.5001: Flags [.], seq 70513:71049, ack 1, win 32768, options [TS val 3633 ecr 3583,eol], length 536
3.708512 IP 10.1.2.2.5001 > 10.1.3.2.49153: Flags [.], ack 71049, win 32768, options [TS val 3708 ecr 3633,eol], length 0
3.708922 IP 10.1.3.2.49153 > 10.1.2.2.5001: Flags [.], seq 71049:71585, ack 1, win 32768, options [TS val 3633 ecr 3583,eol], length 536
3.709596 IP 10.1.3.2.49153 > 10.1.2.2.5001: Flags [.], seq 71585:72121, ack 1, win 32768, options [TS val 3633 ecr 3583,eol], length 536
3.709860 IP 10.1.2.2.5001 > 10.1.3.2.49153: Flags [.], ack 72121, win 32768, options [TS val 3709 ecr 3633,eol], length 0
3.763732 IP 10.1.3.2.49153 > 10.1.2.2.5001: Flags [.], seq 72121:72657, ack 1, win 32768, options [TS val 3712 ecr 3662,eol], length 536
3.764406 IP 10.1.3.2.49153 > 10.1.2.2.5001: Flags [.], seq 72657:73193, ack 1, win 32768, options [TS val 3712 ecr 3662,eol], length 536
3.764671 IP 10.1.2.2.5001 > 10.1.3.2.49153: Flags [.], ack 73193, win 32768, options [TS val 3764 ecr 3712,eol], length 0
3.765081 IP 10.1.3.2.49153 > 10.1.2.2.5001: Flags [.], seq 73193:73729, ack 1, win 32768, options [TS val 3712 ecr 3662,eol], length 536
3.765755 IP 10.1.3.2.49153 > 10.1.2.2.5001: Flags [.], seq 73729:74265, ack 1, win 32768, options [TS val 3712 ecr 3662,eol], length 536
3.766019 IP 10.1.2.2.5001 > 10.1.3.2.49153: Flags [.], ack 74265, win 32768, options [TS val 3765 ecr 3712,eol], length 0
3.766429 IP 10.1.3.2.49153 > 10.1.2.2.5001: Flags [.], seq 74265:74801, ack 1, win 32768, options [TS val 3714 ecr 3663,eol], length 536
3.767104 IP 10.1.3.2.49153 > 10.1.2.2.5001: Flags [.], seq 74801:75337, ack 1, win 32768, options [TS val 3714 ecr 3663,eol], length 536
3.767368 IP 10.1.2.2.5001 > 10.1.3.2.49153: Flags [.], ack 75337, win 32768, options [TS val 3767 ecr 3714,eol], length 0
3.767778 IP 10.1.3.2.49153 > 10.1.2.2.5001: Flags [.], seq 75337:75873, ack 1, win 32768, options [TS val 3714 ecr 3663,eol], length 536
3.768452 IP 10.1.3.2.49153 > 10.1.2.2.5001: Flags [.], seq 75873:76409, ack 1, win 32768, options [TS val 3714 ecr 3663,eol], length 536
3.768716 IP 10.1.2.2.5001 > 10.1.3.2.49153: Flags [.], ack 76409, win 32768, options [TS val 3768 ecr 3714,eol], length 0
3.769126 IP 10.1.3.2.49153 > 10.1.2.2.5001: Flags [.], seq 76409:76945, ack 1, win 32768, options [TS val 3715 ecr 3665,eol], length 536
3.769801 IP 10.1.3.2.49153 > 10.1.2.2.5001: Flags [.], seq 76945:77481, ack 1, win 32768, options [TS val 3715 ecr 3665,eol], length 536
3.770065 IP 10.1.2.2.5001 > 10.1.3.2.49153: Flags [.], ack 77481, win 32768, options [TS val 3769 ecr 3715,eol], length 0
3.770475 IP 10.1.3.2.49153 > 10.1.2.2.5001: Flags [.], seq 77481:78017, ack 1, win 32768, options [TS val 3715 ecr 3665,eol], length 536
3.771149 IP 10.1.3.2.49153 > 10.1.2.2.5001: Flags [.], seq 78017:78553, ack 1, win 32768, options [TS val 3715 ecr 3665,eol], length 536
3.771413 IP 10.1.2.2.5001 > 10.1.3.2.49153: Flags [.], ack 78553, win 32768, options [TS val 3771 ecr 3715,eol], length 0
3.771824 IP 10.1.3.2.49153 > 10.1.2.2.5001: Flags [.], seq 78553:79089, ack 1, win 32768, options [TS val 3716 ecr 3666,eol], length 536
3.772498 IP 10.1.3.2.49153 > 10.1.2.2.5001: Flags [.], seq 79089:79625, ack 1, win 32768, options [TS val 3716 ecr 3666,eol], length 536
3.772762 IP 10.1.2.2.5001 > 10.1.3.2.49153: Flags [.], ack 79625, win 32768, options [TS val 3772 ecr 3716,eol], length 0
3.773172 IP 10.1.3.2.49153 > 10.1.2.2.5001: Flags [.], seq 79625:80161, ack 1, win 32768, options [TS val 3716 ecr 3666,eol], length 536
3.773846 IP 10.1.3.2.49153 > 10.1.2.2.5001: Flags [.], seq 80161:80697, ack 1, win 32768, options [TS val 3716 ecr 3666,eol], length 536
3.774111 IP 10.1.2.2.5001 > 10.1.3.2.49153: Flags [.], ack 80697, win 32768, options [TS val 3773 ecr 3716,eol], length 0
3.774521 IP 10.1.3.2.49153 > 10.1.2.2.5001: Flags [.], seq 80697:81233, ack 1, win 32768, options [TS val 3718 ecr 3667,eol], length 536
3.775195 IP 10.1.3.2.49153 > 10.1.2.2.5001: Flags [.], seq 81233:81769, ack 1, win 32768, options [TS val 3718 ecr 3667,eol], length 536
3.775459 IP 10.1.2.2.5001 > 10.1.3.2.49153: Flags [.], ack 81769, win 32768, options [TS val 3775 ecr 3718,eol], length 0
3.775869 IP 10.1.3.2.49153 > 10.1.2.2.5001: Flags [.], seq 81769:82305, ack 1, win 32768, options [TS val 3718 ecr 3667,eol], length 536
3.776544 IP 10.1.3.2.49153 > 10.1.2.2.5001: Flags [.], seq 82305:82841, ack 1, win 32768, options [TS val 3718 ecr 3667,eol], length 536
3.776808 IP 10.1.2.2.5001 > 10.1.3.2.49153: Flags [.], ack 82841, win 32768, options [TS val 3776 ecr 3718,eol], length 0
3.777218 IP 10.1.3.2.49153 > 10.1.2.2.5001: Flags [.], seq 82841:83377, ack 1, win 32768, options [TS val 3719 ecr 3669,eol], length 536
3.777892 IP 10.1.3.2.49153 > 10.1.2.2.5001: Flags [.], seq 83377:83913, ack 1, win 32768, options [TS val 3719 ecr 3669,eol], length 536
3.778156 IP 10.1.2.2.5001 > 10.1.3.2.49153: Flags [.], ack 83913, win 32768, options [TS val 3778 ecr 3719,eol], length 0
3.778566 IP 10.1.3.2.49153 > 10.1.2.2.5001: Flags [.], seq 83913:84449, ack 1, win 32768, options [TS val 3719 ecr 3669,eol], length 536
3.779241 IP 10.1.3.2.49153 > 10.1.2.2.5001: Flags [.], seq 84449:84985, ack 1, win 32768, options [TS val 3719 ecr 3669,eol], length 536
3.779505 IP 10.1.2.2.5001 > 10.1.3.2.49153: Flags [.], ack 84985, win 32768, options [TS val 3779 ecr 3719,eol], length 0
3.779915 IP 10.1.3.2.49153 > 10.1.2.2.5001: Flags [.], seq 84985:85521, ack 1, win 32768, options [TS val 3720 ecr 3670,eol], length 536
3.780589 IP 10.1.3.2.49153 > 10.1.2.2.5001: Flags [.], seq 85521:86057, ack 1, win 32768, options [TS val 3720 ecr 3670,eol], length 536
3.780853 IP 10.1.2.2.5001 > 10.1.3.2.49153: Flags [.], ack 86057, win 32768, options [TS val 3780 ecr 3720,eol], length 0
3.781264 IP 10.1.3.2.49153 > 10.1.2.2.5001: Flags [.], seq 86057:86593, ack 1, win 32768, options [TS val 3720 ecr 3670,eol], length 536
3.781938 IP 10.1.3.2.49153 > 10.1.2.2.5001: Flags [.], seq 86593:87129, ack 1, win 32768, options [TS val 3720 ecr 3670,eol], length 536
3.782202 IP 10.1.2.2.5001 > 10.1.3.2.49153: Flags [.], ack 87129, win 32768, options [TS val 3782 ecr 3720,eol], length 0
3.782612 IP 10.1.3.2.49153 > 10.1.2.2.5001: Flags [.], seq 87129:87665, ack 1, win 32768, options [TS val 3722 ecr 3671,eol], length 536
3.783286 IP 10.1.3.2.49153 > 10.1.2.2.5001: Flags [.], seq 87665:88201, ack 1, win 32768, options [TS val 3722 ecr 3671,eol], length 536
3.783551 IP 10.1.2.2.5001 > 10.1.3.2.49153: Flags [.], ack 88201, win 32768, options [TS val 3783 ecr 3722,eol], length 0
3.783961 IP 10.1.3.2.49153 > 10.1.2.2.5001: Flags [.], seq 88201:88737, ack 1, win 32768, options [TS val 3722 ecr 3671,eol], length 536
3.784635 IP 10.1.3.2.49153 > 10.1.2.2.5001: Flags [.], seq 88737:89273, ack 1, win 32768, options [TS val 3722 ecr 3671,eol], length 536
3.784899 IP 10.1.2.2.5001 > 10.1.3.2.49153: Flags [.], ack 89273, win 32768, options [TS val 3784 ecr 3722,eol], length 0
3.785309 IP 10.1.3.2.49153 > 10.1.2.2.5001: Flags [.], seq 89273:89809, ack 1, win 32768, options [TS val 3723 ecr 3673,eol], length 536
3.785984 IP 10.1.3.2.49153 > 10.1.2.2.5001: Flags [.], seq 89809:90345, ack 1, win 32768, options [TS val 3723 ecr 3673,eol], length 536
3.786248 IP 10.1.2.2.5001 > 10.1.3.2.49153: Flags [.], ack 90345, win 32768, options [TS val 3786 ecr 3723,eol], length 0
3.786658 IP 10.1.3.2.49153 > 10.1.2.2.5001: Flags [.], seq 90345:90881, ack 1, win 32768, options [TS val 3723 ecr 3673,eol], length 536
3.787332 IP 10.1.3.2.49153 > 10.1.2.2.5001: Flags [.], seq 90881:91417, ack 1, win 32768, options [TS val 3723 ecr 3673,eol], length 536
3.787596 IP 10.1.2.2.5001 > 10.1.3.2.49153: Flags [.], ack 91417, win 32768, options [TS val 3787 ecr 3723,eol], length 0
3.788006 IP 10.1.3.2.49153 > 10.1.2.2.5001: Flags [.], seq 91417:91953, ack 1, win 32768, options [TS val 3724 ecr 3674,eol], length 536
3.788681 IP 10.1.3.2.49153 > 10.1.2.2.5001: Flags [.], seq 91953:92489, ack 1, win 32768, options [TS val 3724 ecr 3674,eol], length 536
3.788945 IP 10.1.2.2.5001 > 10.1.3.2.49153: Flags [.], ack 92489, win 32768, options [TS val 3788 ecr 3724,eol], length 0
3.789355 IP 10.1.3.2.49153 > 10.1.2.2.5001: Flags [.], seq 92489:93025, ack 1, win 32768, options [TS val 3724 ecr 3674,eol], length 536
3.790029 IP 10.1.3.2.49153 > 10.1.2.2.5001: Flags [.], seq 93025:93561, ack 1, win 32768, options [TS val 3724 ecr 3674,eol], length 536
3.790293 IP 10.1.2.2.5001 > 10.1.3.2.49153: Flags [.], ack 93561, win 32768, options [TS val 3790 ecr 3724,eol], length 0
3.790704 IP 10.1.3.2.49153 > 10.1.2.2.5001: Flags [.], seq 93561:94097, ack 1, win 32768, options [TS val 3726 ecr 3676,eol], length 536
3.791378 IP 10.1.3.2.49153 > 10.1.2.2.5001: Flags [.], seq 94097:94633, ack 1, win 32768, options [TS val 3726 ecr 3676,eol], length 536
3.791642 IP 10.1.2.2.5001 > 10.1.3.2.49153: Flags [.], ack 94633, win 32768, options [TS val 3791 ecr 3726,eol], length 0
3.792052 IP 10.1.3.2.49153 > 10.1.2.2.5001: Flags [.], seq 94633:95169, ack 1, win 32768, options [TS val 3726 ecr 3676,eol], length 536
3.792726 IP 10.1.3.2.49153 > 10.1.2.2.5001: Flags [.], seq 95169:95705, ack 1, win 32768, options [TS val 3726 ecr 3676,eol], length 536
3.792991 IP 10.1.2.2.5001 > 10.1.3.2.49153: Flags [.], ack 95705, win 32768, options [TS val 3792 ecr 3726,eol], length 0
3.793401 IP 10.1.3.2.49153 > 10.1.2.2.5001: Flags [.], seq 95705:96241, ack 1, win 32768, options [TS val 3727 ecr 3677,eol], length 536
3.794075 IP 10.1.3.2.49153 > 10.1.2.2.5001: Flags [.], seq 96241:96777, ack 1, win 32768, options [TS val 3727 ecr 3677,eol], length 536
3.794339 IP 10.1.2.2.5001 > 10.1.3.2.49153: Flags [.], ack 96777, win 32768, options [TS val 3794 ecr 3727,eol], length 0
3.794749 IP 10.1.3.2.49153 > 10.1.2.2.5001: Flags [.], seq 96777:97313, ack 1, win 32768, options [TS val 3727 ecr 3677,eol], length 536
3.795424 IP 10.1.3.2.49153 > 10.1.2.2.5001: Flags [.], seq 97313:97849, ack 1, win 32768, options [TS val 3727 ecr 3677,eol], length 536
3.795688 IP 10.1.2.2.5001 > 10.1.3.2.49153: Flags [.], ack 97849, win 32768, options [TS val 3795 ecr 3727,eol], length 0
3.796098 IP 10.1.3.2.49153 > 10.1.2.2.5001: Flags [.], seq 97849:98385, ack 1, win 32768, options [TS val 3729 ecr 3678,eol], length 536
3.796772 IP 10.1.3.2.49153 > 10.1.2.2.5001: Flags [.], seq 98385:98921, ack 1, win 32768, options [TS val 3729 ecr 3678,eol], length 536
3.797036 IP 10.1.2.2.5001 > 10.1.3.2.49153: Flags [.], ack 98921, win 32768, options [TS val 3796 ecr 3729,eol], length 0
3.797446 IP 10.1.3.2.49153 > 10.1.2.2.5001: Flags [.], seq 98921:99457, ack 1, win 32768, options [TS val 3729 ecr 3678,eol], length 536
3.798121 IP 10.1.3.2.49153 > 10.1.2.2.5001: Flags [.], seq 99457:99993, ack 1, win 32768, options [TS val 3729 ecr 3678,eol], length 536
3.798385 IP 10.1.2.2.5001 > 10.1.3.2.49153: Flags [.], ack 99993, win 32768, options [TS val 3798 ecr 3729,eol], length 0
3.798795 IP 10.1.3.2.49153 > 10.1.2.2.5001: Flags [.], seq 99993:100529, ack 1, win 32768, options [TS val 3730 ecr 3680,eol], length 536
3.799469 IP 10.1.3.2.49153 > 10.1.2.2.5001: Flags [.], seq 100529:101065, ack 1, win 32768, options [TS val 3730 ecr 3680,eol], length 536
3.799733 IP 10.1.2.2.5001 > 10.1.3.2.49153: Flags [.], ack 101065, win 32768, options [TS val 3799 ecr 3730,eol], length 0
3.800144 IP 10.1.3.2.49153 > 10.1.2.2.5001: Flags [.], seq 101065:101601, ack 1, win 32768, options [TS val 3730 ecr 3680,eol], length 536
3.800818 IP 10.1.3.2.49153 > 10.1.2.2.5001: Flags [.], seq 101601:102137, ack 1, win 32768, options [TS val 3730 ecr 3680,eol], length 536
3.801082 IP 10.1.2.2.5001 > 10.1.3.2.49153: Flags [.], ack 102137, win 32768, options [TS val 3800 ecr 3730,eol], length 0
3.801492 IP 10.1.3.2.49153 > 10.1.2.2.5001: Flags [.], seq 102137:102673, ack 1, win 32768, options [TS val 3731 ecr 3681,eol], length 536
3.802166 IP 10.1.3.2.49153 > 10.1.2.2.5001: Flags [.], seq 102673:103209, ack 1, win 32768, options [TS val 3731 ecr 3681,eol], length 536
3.802431 IP 10.1.2.2.5001 > 10.1.3.2.49153: Flags [.], ack 103209, win 32768, options [TS val 3802 ecr 3731,eol], length 0
3.802841 IP 10.1.3.2.49153 > 10.1.2.2.5001: Flags [.], seq 103209:103745, ack 1, win 32768, options [TS val 3731 ecr 3681,eol], length 536
3.803515 IP 10.1.3.2.49153 > 10.1.2.2.5001: Flags [.], seq 103745:104281, ack 1, win 32768, options [TS val 3731 ecr 3681,eol], length 536
3.803779 IP 10.1.2.2.5001 > 10.1.3.2.49153: Flags [.], ack 104281, win 32768, options [TS val 3803 ecr 3731,eol], length 0
3.804189 IP 10.1.3.2.49153 > 10.1.2.2.5001: Flags [.], seq 104281:104817, ack 1, win 32768, options [TS val 3733 ecr 3682,eol], length 536
